"SPANISH MINISTRY OF ECONOMY AND COMPETITIVENESS CONSOLIDER INGENIO",1,0.282
"SPANISH MINISTRY OF ECONOMY AND COMPETITIVENESS FISHJELLY PROJECT",1,0.282
"SPANISH MINISTRY OF ECONOMY AND COMPETITIVENESS THROUGH THE MARIA DE MAEZTU PROGRAMME FOR CENTRES UNITS OF EXCELLENCE IN RD",1,0.282
"SPANISH MINISTRY OF EDUCATION PROGRAMA NACIONAL DE MOVILIDAD DE RECURSOS HUMANOS DE INVESTIGACION",1,0.282
"SPANISH NATIONAL PROGRAM RAMON Y CAJAL",1,0.282
"SPANISH PROGRAMME FOR TALENT AND EMPLOYABILITY IN R I TORRES QUEVEDO",1,0.282
"SPANISH PROJECT FISHJELLY",1,0.282
"STATE EDUCATION MINISTRY",1,0.282
"STATE OF CALIFORNIA",3,0.847
"STOPJELLY PROJECT",2,0.565
"STRATEGIC RESEARCH COUNCIL AT THE ACADEMY OF FINLAND PROJECT WISE",1,0.282
"SWEDISH RESEARCH COUNCIL FORMAS",1,0.282
"TAAF ADMINISTRATION",1,0.282
"TAISHAN SCHOLAR CLIMBING PLAN",1,0.282
"TAIWAN MINISTRY OF SCIENCE AND TECHNOLOGY MOST",1,0.282
"THAILAND RESEARCH FUND TRF",1,0.282
"THE DAVID LUCILE PACKARD FOUNDATION",5,1.412
"THOMAS JEFFERSON FUND MAKE OUR PLANET GREAT AGAIN INITIATIVE",1,0.282
"TIAA CREF AND SOCIAL SECURITYUNITED STATES",1,0.282
"TIAA CREF USA",1,0.282
"TOTAL SA",1,0.282
"TRAINING AND RESEARCH IN ITALIAN LABORATORIES TRIL PROGRAMME",1,0.282
"TU KAISERSLAUTERN GERMANY",1,0.282
"TULA MITACS CANADA",1,0.282
"TURKIYE BILIMSEL VE TEKNOLOJIK ARASTIRMA KURUMU TUBITAK",1,0.282
"UBC CORDULA AND GUNTER PAETZOLD FELLOWSHIP",1,0.282
"UCSC POSTGRADUATE INSTITUTIONAL RELATIONS AND RESEARCH AND INNOVATION DIRECTORATES",1,0.282
"UK DEPARTMENT FOR BUSINESS AND INDUSTRIAL STRATEGY BEIS",1,0.282
"UK RESEARCH INNOVATION UKRI",22,6.215
"UNITED NATIONS ENVIRONMENT PROGRAMME WORLD CONSERVATION MONITORING CENTRE",1,0.282
"UNITED STATES ARMY",2,0.565
"UNITED STATES DEPARTMENT OF DEFENSE",4,1.13
"UNITED STATES NATIONAL OCEANIC AND ATMOSPHERIC ADMINISTRATION NATIONAL MARINE FISHERIES SERVICE NOAA NMFS PACIFIC ISLANDS FISHERIES SCIENCE CENTER",1,0.282
"UNITED STATES NATIONAL OCEANIC AND ATMOSPHERIC ADMINISTRATION NATIONAL MARINE FISHERIES SERVICE NOAA NMFS SOUTHWEST FISHERIES SCIENCE CENTER",1,0.282
"UNIVERSIDAD DE COSTA RICA",1,0.282
"UNIVERSIDAD DEL VALLE",1,0.282
"UNIVERSIDAD JUAREZ AUTONOMA DE TABASCO",1,0.282
"UNIVERSIDAD NACIONAL AUTONOMA DE MEXICO OF THE DIRECCION GENERAL DE ASUNTOS DEL PERSONAL ACADEMICO",1,0.282
"UNIVERSITI MALAYA",1,0.282
"UNIVERSITY OF BARCELONA",1,0.282
"UNIVERSITY OF BRITISH COLUMBIA",4,1.13
"UNIVERSITY OF BRITISH COLUMBIA VANCOUVER",1,0.282
"UNIVERSITY OF CALIFORNIA AT SANTA BARBARA",3,0.847
"UNIVERSITY OF GIRONA",1,0.282
"UNIVERSITY OF KWAZULU NATAL UKZN DURBAN",1,0.282
"UNIVERSITY OF MALTA",1,0.282
"UNIVERSITY OF MELBOURNE",1,0.282
"UNIVERSITY OF SOUTH ALABAMA MARINE SCIENCES GRADUATE FELLOWSHIP",1,0.282
"UNIVERSITY OF SOUTHAMPTON",1,0.282
"UNIVERSITY OF THE WESTERN CAPE",2,0.565
"UNIVERSITY OF WASHINGTON",1,0.282
"US CONGRESS",1,0.282
"US EPA S NATIONAL ESTUARY PROGRAM",1,0.282
"US GLOBEC",1,0.282
"US GLOBEC PAN REGIONAL SYNTHESIS",1,0.282
"US GLOBEC PROGRAM",1,0.282
"US MARITIME ADMINISTRATION THROUGH THE MARITIME ENVIRONMENTAL RESOURCE CENTER MARYLAND USA",1,0.282
"USDA NATIONAL INSTITUTE OF FOOD AND AGRICULTURE HATCH PROJECT",1,0.282
"USGS WHOI COOPERATIVE PROGRAM",1,0.282
"VECTORS VECTORS OF CHANGE IN OCEANS AND SEAS MARINE LIFE IMPACT ON ECONOMIC SECTORS",1,0.282
"W M KECK FOUNDATION",1,0.282
"WASHINGTON DEPARTMENT OF ECOLOGY S INTENSIVELY MONITORED WATERSHEDS PROGRAM",1,0.282
"WASHINGTON DEPARTMENT OF FISH AND WILDLIFE WDFW",1,0.282
"WASHINGTON DEPARTMENT OF NATURAL RE SOURCES",1,0.282
"WASHINGTON STATE DEPARTMENT OF NATURAL RESOURCES",1,0.282
"WEALTH FROM OCEANS FLAGSHIP",1,0.282
"WHALE HABITAT PROFESSORSHIP ENDOWMENT FUND MARINE MAMMAL INSTITUTE OREGON STATE UNIVERSITY",1,0.282
"WOODS HOLE OCEANOGRAPHIC INSTITUTION S OCEAN TWILIGHT ZONE PROJECT",1,0.282
"WOODS HOLE OCEANOGRAPHIC INSTITUTION S OCEAN VENTURES FUND",1,0.282
"WORLD WIDE FUND WWF SA STELLENBOSCH",1,0.282
"WORLD WILDLIFE FOUNDATION EDUCATION FOR NATURE",1,0.282
"WORLD WILDLIFE FUND EDUCATION FOR NATURE",1,0.282
"WWF IN THE NETHERLANDS",1,0.282
"WWF UK",1,0.282
"YANTAI SCIENCE AND TECHNOLOGY BUREAU",1,0.282
"YOUTH INNOVATION PROMOTION ASSOCIATION CAS",1,0.282
"YUCATAN STATE GOVERNMENT",1,0.282
"ZONE ATELIER ANTARCTIQUE CNRS",1,0.282
"ZOOLOGICAL SURVEY OF INDIA KOLKATA",1,0.282
"86 record(s) (24.294%) do not contain data in the field being analyzed",NA,NA
